<?xml version="1.0" encoding="UTF-8" ?>
<clinicaVeterinaria xmlns:xsi="http://www.w3.org/2001/XMLSchema-instance"
        xmlns="http://www.misitio.com"
        xsi:schemaLocation="http://www.misitio.com clinicaVeterinaria.xsd">
        <cliente>
                <nombre>Pedro</nombre>
                <apellidos>Picapiedra</apellidos>
                <animal sexo="H">
                        <nombre>Perro</nombre>
                        <edad>10</edad>
                        <raza>a saber</raza>
                        <tipo>perro</tipo>
                </animal>
        </cliente>
        <cliente>
                <nombre>Pedro</nombre>
                <apellidos>Picapiedra</apellidos>
                <animal sexo="H">
                        <nombre>Perro</nombre>
                        <edad>10</edad>
                        <raza>a saber</raza>
                        <tipo>perro</tipo>
                </animal>
        </cliente>
        <cliente>
                <nombre>Pedro</nombre>
                <apellidos>Picapiedra</apellidos>
                <animal sexo="H">
                        <nombre>Perro</nombre>
                        <edad>10</edad>
                        <raza>a saber</raza>
                        <tipo>perro</tipo>
                </animal>
        </cliente>
</clinicaVeterinaria>